Document Title,EC1,EC2,EC3,EC4,EC5
PTRebeca: Modeling and analysis of distributed and asynchronous systems,X,-,-,-,-
Design and development of BIM models to support operations and maintenance,X,-,-,-,-
ScriptEase: A generative/adaptive programming paradigm for game scripting,X,-,-,-,-
Use of mixed reality for surgery planning: Assessment and development workflow,X,-,-,-,-
Coupled Rigid-Block Analysis: Stability-Aware Design of Complex Discrete-Element Assemblies,X,-,-,-,-
Serious games for rehabilitation: Gestural interaction in personalized gamified exercises through a recommender system,X,-,-,-,-
The influence of the city metaphor and its derivates in software visualization,X,-,-,-,-
Utilizing Depth Based Sensors and Customizable Software Frameworks for Experiential Application,X,-,-,-,-
Deep Reinforcement Learning Based Unmanned Aerial Vehicle (UAV) Control Using 3D Hand Gestures,X,-,-,-,-
An Immersive 3D Virtual Learning Environment for Analyzing the Atomic Structure of MEMS-Relevant Materials,X,-,-,-,-
A Support System to Accumulate Interpretations of Multiple Story Timelines,X,-,-,-,-
Enhancing Historical Learning Using Role-Playing Game on Mobile Platform,X,-,-,-,-
From board games to immersive urban imaginaries: Visualization fidelity's impact on stimulating discussions on urban transformation,X,-,-,-,-
An IoMT based cyber training framework for orthopedic surgery using Next Generation Internet technologies,X,-,-,-,-
Virtual Reality Training System as a comprehensive and effective method for delivering technical hands-on training in the field of Distribution System Operators,X,-,-,-,-
Hybrid recommendations and dynamic authoring for AR knowledge capture and re-use in diagnosis applications,X,-,-,-,-
Help The Math Town: Adaptive Multiplayer Math-Science Games using Fuzzy Logic,X,-,-,-,-
Online-Gym: A 3D Virtual Gymnasium Using Kinect Interaction,X,-,-,-,-
A rapid prototyping tool to produce 360° video-based immersive experiences enhanced with virtual/multimedia elements,X,-,-,-,-
Exploring the repair process of a 3D printer using augmented reality-based guidance,X,-,-,-,-
A Mobile Solution to Enhance Training and Execution of Troubleshooting Techniques of the Engine Air Bleed System on Boeing 737,X,-,-,-,-
Vision based crown loss estimation for individual trees with remote aerial robots,X,-,-,-,-
SIT6: Indirect touch-based object manipulation for DeskVR,X,-,-,-,-
Modeling bounded and unbounded space with polyhedra: Topology and operators for manifold cell complexes,X,-,-,-,-
Leveraging 3D geometric knowledge in the product lifecycle based on industrial standards,X,-,-,-,-
"Measuring digital intervention user experience with a novel ecological momentary assessment (EMA) method, CORTO",X,-,-,-,-